{
  "artifact_hash": "sha256:13c0afd6816833c640fea2bddc12be62111906115fd6dcfcd22c2e9213bf9c76",
  "artifact_id": "DOC-sha256-d61d88fe14346fe72e70d821ef4ba2f9f091fc748097c9df9c475c6764493e0b",
  "created_at": "2026-07-23T03:47:43.937756Z",
  "created_by": {
    "actor_type": "system",
    "host": "research-cli",
    "model_identifier": null
  },
  "document_id": "DOC-sha256-d61d88fe14346fe72e70d821ef4ba2f9f091fc748097c9df9c475c6764493e0b",
  "file_size": 569,
  "import_aliases": [
    "C:\\Users\\jeehoon\\OneDrive\\문서\\Automated_research\\benchmark\\sources\\synthetic-study-copy.md"
  ],
  "media_type": "text/markdown",
  "metadata": {
    "original_filename": "synthetic-study-copy.md"
  },
  "original_storage_path": "originals/sha256/d6/1d/d61d88fe14346fe72e70d821ef4ba2f9f091fc748097c9df9c475c6764493e0b",
  "schema_name": "Document",
  "schema_version": "1.0.0",
  "source_sha256": "sha256:d61d88fe14346fe72e70d821ef4ba2f9f091fc748097c9df9c475c6764493e0b"
}
