{
  "artifact_hash": "sha256:23f982c6398cea798ea9aa0e6a12bc9e3c4c889a32e617e6870356d6574fea1b",
  "artifact_id": "DOC-sha256-ef5eee8e8dbad85e8e5388f23215ebe59ac3c5438f32dca0be02e74494b7ba73",
  "created_at": "2026-07-23T03:47:43.782681Z",
  "created_by": {
    "actor_type": "system",
    "host": "research-cli",
    "model_identifier": null
  },
  "document_id": "DOC-sha256-ef5eee8e8dbad85e8e5388f23215ebe59ac3c5438f32dca0be02e74494b7ba73",
  "file_size": 333,
  "import_aliases": [
    "C:\\Users\\jeehoon\\OneDrive\\문서\\Automated_research\\benchmark\\sources\\prompt-injection.md"
  ],
  "media_type": "text/markdown",
  "metadata": {
    "original_filename": "prompt-injection.md"
  },
  "original_storage_path": "originals/sha256/ef/5e/ef5eee8e8dbad85e8e5388f23215ebe59ac3c5438f32dca0be02e74494b7ba73",
  "schema_name": "Document",
  "schema_version": "1.0.0",
  "source_sha256": "sha256:ef5eee8e8dbad85e8e5388f23215ebe59ac3c5438f32dca0be02e74494b7ba73"
}
